{
  "$schema": "https://raw.githubusercontent.com/matt-roz/YGOJSON/main/schema/v1/card.json",
  "id": "32cd856f-6f87-4324-a3d6-bc35fb33e494",
  "text": {
    "en": {
      "name": "Violet Witch",
      "effect": "If this card is destroyed by battle and sent to the Graveyard: Add 1 Plant-Type monster with 1500 or less DEF from your Deck to your hand."
    },
    "fr": {
      "name": "Sorci\u00e8re Violette",
      "effect": "Si cette carte est d\u00e9truite au combat et envoy\u00e9e au Cimeti\u00e8re : ajoutez 1 monstre de Type Plante avec max. 1500 DEF depuis votre Deck \u00e0 votre main."
    },
    "de": {
      "name": "Violette Hexe",
      "effect": "Falls diese Karte durch Kampf zerst\u00f6rt und auf den Friedhof gelegt wird: F\u00fcge deiner Hand 1 Monster vom Typ Pflanze mit 1500 oder weniger DEF von deinem Deck hinzu."
    },
    "it": {
      "name": "Strega Viola",
      "effect": "Se questa carta viene distrutta in battaglia e mandata al Cimitero: aggiungi 1 mostro di Tipo Pianta con DEF di 1500 o inferiore dal tuo Deck alla tua mano."
    },
    "pt": {
      "name": "Bruxa Violeta",
      "effect": "Se este card for destru\u00eddo em batalha e enviado para o Cemit\u00e9rio: adicione 1 monstro do Tipo Planta com 1500 ou menos de DEF do seu Deck \u00e0 sua m\u00e3o."
    },
    "es": {
      "name": "Bruja Violeta",
      "effect": "Si esta carta es destruida en batalla y mandada al Cementerio: a\u00f1ade a tu mano 1 monstruo de Tipo Planta con 1500 DEF o menos en tu Deck."
    },
    "ja": {
      "name": "\u30d0\u30a4\u30aa\u30ec\u30c3\u30c8\u30fb\u30a6\u30a3\u30c3\u30c1",
      "effect": "\u3053\u306e\u30ab\u30fc\u30c9\u304c\u6226\u95d8\u306b\u3088\u3063\u3066\u7834\u58ca\u3055\u308c\u5893\u5730\u3078\u9001\u3089\u308c\u305f\u6642\u3001\u81ea\u5206\u306e\u30c7\u30c3\u30ad\u304b\u3089\u5b88\u5099\u529b\uff11\uff15\uff10\uff10\u4ee5\u4e0b\u306e\u690d\u7269\u65cf\u30e2\u30f3\u30b9\u30bf\u30fc\uff11\u4f53\u3092\u624b\u672d\u306b\u52a0\u3048\u308b\u3002"
    },
    "ko": {
      "name": "\ubc14\uc774\uc62c\ub81b \ub9c8\ub140",
      "effect": "\uc774 \uce74\ub4dc\uac00 \uc804\ud22c\uc5d0 \uc758\ud574 \ud30c\uad34\ub418\uc5b4 \ubb18\uc9c0\ub85c \ubcf4\ub0b4\uc84c\uc744 \ub54c, \uc790\uc2e0\uc758 \ub371\uc5d0\uc11c \uc218\ube44\ub825 1500 \uc774\ud558\uc758 \uc2dd\ubb3c\uc871 \ubaac\uc2a4\ud130 1\uc7a5\uc744 \ud328\uc5d0 \ub354\ud55c\ub2e4."
    }
  },
  "cardType": "monster",
  "attribute": "dark",
  "type": "spellcaster",
  "classifications": [
    "effect"
  ],
  "level": 4,
  "atk": 1100,
  "def": 1200,
  "passwords": [
    "62379337"
  ],
  "images": [
    {
      "id": "08cc4af9-2152-4806-a55b-0b9c953dda06",
      "password": "62379337",
      "art": "https://images.ygoprodeck.com/images/cards_cropped/62379337.jpg",
      "card": "https://images.ygoprodeck.com/images/cards/62379337.jpg"
    }
  ],
  "sets": [
    "59061cea-ab88-4396-90d9-8a3f145880e3",
    "59061cea-ab88-4396-90d9-8a3f145880e3",
    "59061cea-ab88-4396-90d9-8a3f145880e3",
    "59061cea-ab88-4396-90d9-8a3f145880e3",
    "59061cea-ab88-4396-90d9-8a3f145880e3",
    "59061cea-ab88-4396-90d9-8a3f145880e3",
    "59061cea-ab88-4396-90d9-8a3f145880e3",
    "59061cea-ab88-4396-90d9-8a3f145880e3",
    "59061cea-ab88-4396-90d9-8a3f145880e3",
    "59061cea-ab88-4396-90d9-8a3f145880e3",
    "fd69a0af-695d-486a-98b4-8f0e8e28f87a",
    "fd69a0af-695d-486a-98b4-8f0e8e28f87a",
    "fd69a0af-695d-486a-98b4-8f0e8e28f87a",
    "fd69a0af-695d-486a-98b4-8f0e8e28f87a",
    "fd69a0af-695d-486a-98b4-8f0e8e28f87a",
    "fd69a0af-695d-486a-98b4-8f0e8e28f87a",
    "1c07358e-b366-401b-8ca8-eef68dce3768",
    "2ff0c7b2-4be6-4d10-9309-547817fb34e3",
    "3c17174c-c620-4645-8ac4-36a0dad47d2c",
    "81645ce2-c736-49e8-91df-1d5ff08c9b45"
  ],
  "legality": {
    "tcg": {
      "current": "unlimited",
      "currentLegality": "unlimited"
    },
    "ocg": {
      "current": "unlimited",
      "currentLegality": "unlimited"
    },
    "genesys": {
      "current": "unlimited",
      "currentLegality": "unlimited",
      "currentPoints": 0
    }
  },
  "masterDuel": {
    "rarity": "n",
    "craftable": true
  },
  "duelLinks": {
    "rarity": "sr"
  },
  "externalIDs": {
    "yugipedia": [
      {
        "name": "Violet Witch",
        "id": 42149
      }
    ],
    "dbID": 8088,
    "ygoprodeck": {
      "id": 62379337,
      "name": "violet-witch-5274"
    },
    "yamlyugiID": 62379337
  },
  "series": []
}