{
  "$schema": "https://raw.githubusercontent.com/matt-roz/YGOJSON/main/schema/v1/card.json",
  "id": "42fc7e16-14f5-4067-b021-afa395d4e9b3",
  "text": {
    "en": {
      "name": "Satellarknight Sirius",
      "effect": "If this card is Summoned: You can target 5 \"tellarknight\" monsters in your Graveyard; shuffle all 5 into the Deck, then draw 1 card. You can only use this effect of \"Satellarknight Sirius\" once per turn."
    },
    "fr": {
      "name": "Satellchevalier Sirius",
      "effect": "Si cette carte est Invoqu\u00e9e : vous pouvez cibler 5 monstres \"tellchevalier\" dans votre Cimeti\u00e8re ; m\u00e9langez-les tous les 5 dans le Deck, puis piochez 1 carte. Vous ne pouvez utiliser cet effet de \"Satellchevalier Sirius\" qu'une fois par tour."
    },
    "de": {
      "name": "Fixsternritter Sirius",
      "effect": "Falls diese Karte beschworen wird: Du kannst 5 \u201eSternritter\u201c-Monster in deinem Friedhof w\u00e4hlen; mische alle 5 ins Deck, dann ziehe 1 Karte. Du kannst diesen Effekt von \u201eFixsternritter Sirius\u201c nur einmal pro Spielzug verwenden."
    },
    "it": {
      "name": "Satellcavaliere Sirio",
      "effect": "Se questa carta viene Evocata: puoi scegliere come bersaglio 5 mostri \"tellcavaliere\" nel tuo Cimitero; mischiali tutti e 5 nel Deck, poi pesca 1 carta. Puoi utilizzare questo effetto di \"Satellcavaliere Sirio\" una sola volta per turno."
    },
    "pt": {
      "name": "Cavaleirost\u00e9lite Sirius",
      "effect": "Se este card for Invocado: voc\u00ea pode escolher 5 monstros \"Cavaleirost\" no seu Cemit\u00e9rio; embaralhe todos os 5 no Deck e, depois, compre 1 card. Voc\u00ea s\u00f3 pode usar este efeito de \"Cavaleirost\u00e9lite Sirius\" uma vez por turno."
    },
    "es": {
      "name": "Satelcaballero Sirio",
      "effect": "Si esta carta es Invocada: puedes seleccionar 5 monstruos \"telcaballero\" en tu Cementerio; baraja los 5 al Deck, y despu\u00e9s roba 1 carta. S\u00f3lo puedes usar este efecto de \"Satelcaballero Sirio\" una vez por turno."
    },
    "ja": {
      "name": "\u661f\u56e0\u58eb \u30b7\u30ea\u30a6\u30b9",
      "effect": "\u300c\u661f\u56e0\u58eb \u30b7\u30ea\u30a6\u30b9\u300d\u306e\u52b9\u679c\u306f\uff11\u30bf\u30fc\u30f3\u306b\uff11\u5ea6\u3057\u304b\u4f7f\u7528\u3067\u304d\u306a\u3044\u3002\u2460\uff1a\u3053\u306e\u30ab\u30fc\u30c9\u304c\u53ec\u559a\u30fb\u53cd\u8ee2\u53ec\u559a\u30fb\u7279\u6b8a\u53ec\u559a\u306b\u6210\u529f\u3057\u305f\u5834\u5408\u3001\u81ea\u5206\u306e\u5893\u5730\u306e\u300c\u30c6\u30e9\u30ca\u30a4\u30c8\u300d\u30e2\u30f3\u30b9\u30bf\u30fc\uff15\u4f53\u3092\u5bfe\u8c61\u3068\u3057\u3066\u767a\u52d5\u3067\u304d\u308b\u3002\u305d\u306e\u30e2\u30f3\u30b9\u30bf\u30fc\uff15\u4f53\u3092\u30c7\u30c3\u30ad\u306b\u623b\u3057\u3066\u30b7\u30e3\u30c3\u30d5\u30eb\u3059\u308b\u3002\u305d\u306e\u5f8c\u3001\u81ea\u5206\u306f\u30c7\u30c3\u30ad\u304b\u3089\uff11\u679a\u30c9\u30ed\u30fc\u3059\u308b\u3002"
    },
    "ko": {
      "name": "\uc0ac\ud14c\ub77c\ub098\uc774\ud2b8 \uc2dc\ub9ac\uc6b0\uc2a4",
      "effect": "\"\uc0ac\ud14c\ub77c\ub098\uc774\ud2b8 \uc2dc\ub9ac\uc6b0\uc2a4\"\uc758 \ud6a8\uacfc\ub294 1\ud134\uc5d0 1\ubc88\ubc16\uc5d0 \uc0ac\uc6a9\ud560 \uc218 \uc5c6\ub2e4. \u2460 : \uc774 \uce74\ub4dc\uac00 \uc77c\ubc18 \uc18c\ud658 / \ubc18\uc804 \uc18c\ud658 / \ud2b9\uc218 \uc18c\ud658\uc5d0 \uc131\uacf5\ud588\uc744 \uacbd\uc6b0, \uc790\uc2e0 \ubb18\uc9c0\uc758 \"\ud14c\ub77c\ub098\uc774\ud2b8\" \ubaac\uc2a4\ud130 5\uc7a5\uc744 \ub300\uc0c1\uc73c\ub85c \ud558\uace0 \ubc1c\ub3d9\ud560 \uc218 \uc788\ub2e4. \uadf8 \ubaac\uc2a4\ud130 5\uc7a5\uc744 \ub371\uc73c\ub85c \ub418\ub3cc\ub9ac\uace0 \uc154\ud50c\ud55c\ub2e4. \uadf8 \ud6c4, \uc790\uc2e0\uc740 \ub371\uc5d0\uc11c 1\uc7a5 \ub4dc\ub85c\uc6b0\ud55c\ub2e4."
    },
    "zh-CN": {
      "name": "\u536b\u661f\u9a91\u58eb \u5927\u72ac\u897f\u5229\u4e4c\u65af",
      "effect": "\u6b64\u5361\u540d\u7684\u6548\u679c\uff11\u56de\u5408\u4ec5\u53ef\u4f7f\u7528\uff11\u6b21\u3002\u2460\uff1a\u6b64\u5361\u53ec\u5524\u30fb\u53cd\u8f6c\u53ec\u5524\u30fb\u7279\u6b8a\u53ec\u5524\u6210\u529f\u7684\u60c5\u51b5\u4e0b\uff0c\u4ee5\u81ea\u5df1\u5893\u5730\u7684\uff15\u53ea\u201c\u661f\u9a91\u58eb\u201d\u602a\u517d\u4e3a\u5bf9\u8c61\u53ef\u4ee5\u53d1\u52a8\u3002\u5c06\u8be5\uff15\u53ea\u602a\u517d\u653e\u56de\u724c\u7ec4\u6d17\u724c\u3002\u7136\u540e\u81ea\u5df1\u4ece\u724c\u7ec4\u62bd\uff11\u5f20\u3002"
    }
  },
  "cardType": "monster",
  "attribute": "light",
  "type": "warrior",
  "classifications": [
    "effect"
  ],
  "level": 4,
  "atk": 1600,
  "def": 900,
  "passwords": [
    "63274863"
  ],
  "images": [
    {
      "id": "3f728b10-1bdc-4561-915f-5d65adf90aed",
      "password": "63274863",
      "art": "https://images.ygoprodeck.com/images/cards_cropped/63274863.jpg",
      "card": "https://images.ygoprodeck.com/images/cards/63274863.jpg"
    }
  ],
  "sets": [
    "6651399f-45d7-4ccb-af30-3315ee938022",
    "6651399f-45d7-4ccb-af30-3315ee938022",
    "6651399f-45d7-4ccb-af30-3315ee938022",
    "6651399f-45d7-4ccb-af30-3315ee938022",
    "6651399f-45d7-4ccb-af30-3315ee938022",
    "6651399f-45d7-4ccb-af30-3315ee938022",
    "6651399f-45d7-4ccb-af30-3315ee938022",
    "6651399f-45d7-4ccb-af30-3315ee938022",
    "89f961c5-27a4-4062-868d-58c61f888c17",
    "89f961c5-27a4-4062-868d-58c61f888c17",
    "89f961c5-27a4-4062-868d-58c61f888c17",
    "89f961c5-27a4-4062-868d-58c61f888c17",
    "89f961c5-27a4-4062-868d-58c61f888c17",
    "89f961c5-27a4-4062-868d-58c61f888c17",
    "5fe0dd43-8998-484e-aa72-9bdf05e012f2",
    "0aa19b78-a439-4dee-bdb5-8d8a4dbc9338",
    "9a9b4279-b7af-4158-896b-d7cd460b306c",
    "a18d25e1-cb35-4f3c-bbed-ea0a0500e8ba",
    "ec0c36ab-8f25-4e05-9dd5-34bb55c90455"
  ],
  "legality": {
    "tcg": {
      "current": "unlimited",
      "currentLegality": "unlimited"
    },
    "ocg": {
      "current": "unlimited",
      "currentLegality": "unlimited"
    },
    "genesys": {
      "current": "unlimited",
      "currentLegality": "unlimited",
      "currentPoints": 0
    }
  },
  "masterDuel": {
    "rarity": "r",
    "craftable": true
  },
  "duelLinks": {
    "rarity": "n"
  },
  "externalIDs": {
    "yugipedia": [
      {
        "name": "Satellarknight Sirius",
        "id": 308667
      }
    ],
    "dbID": 11359,
    "ygoprodeck": {
      "id": 63274863,
      "name": "satellarknight-sirius-5346"
    },
    "yamlyugiID": 63274863
  },
  "series": [
    "5cd82853-817d-4dbb-aee4-81fb23ac4457",
    "23c5e25f-7088-48de-a181-87784888b4f2"
  ]
}